{
  "question_id": "Q11",
  "registry_version": 1,
  "kind": "live",
  "as_of": "2026-10-15T09:30:00.000Z",
  "scope": {
    "repository_id": "00000000-0000-4000-8000-0000000000a1",
    "from": "2026-07-01T00:00:00.000Z",
    "to": "2026-09-30T23:59:59.999Z"
  },
  "availability": "partial",
  "reasons": [
    {
      "code": "partial_linkage"
    }
  ],
  "figures": [
    {
      "key": "findings_observed",
      "availability": "partial",
      "reasons": [
        {
          "code": "partial_linkage"
        },
        {
          "code": "not_captured_yet",
          "gap": "G10"
        }
      ],
      "value": {
        "type": "count",
        "count": 3
      },
      "breakdown": [
        {
          "dimension": "rule_category",
          "key": "execution",
          "value": {
            "type": "count",
            "count": 3
          }
        }
      ]
    }
  ],
  "wording": [
    "monitor_only_observed",
    "session_link_partial"
  ],
  "drilldown": []
}
