{
  "question_id": "S2",
  "registry_version": 1,
  "kind": "signed",
  "as_of": "2026-10-15T09:30:00.000Z",
  "scope": {
    "repository_id": "00000000-0000-4000-8000-0000000000a1",
    "from": "2026-07-01T00:00:00.000Z",
    "to": "2026-09-30T23:59:59.999Z"
  },
  "availability": "unavailable",
  "reasons": [
    {
      "code": "not_captured_yet",
      "gap": "G7"
    }
  ],
  "figures": [
    {
      "key": "machines_monitored",
      "availability": "unavailable",
      "reasons": [
        {
          "code": "not_captured_yet",
          "gap": "G7"
        }
      ],
      "value": null
    }
  ],
  "wording": [
    "monitor_only_observed"
  ],
  "drilldown": [],
  "signed": {
    "statement_digest": "sha256:7777777777777777777777777777777777777777777777777777777777777777",
    "predicate_type": "https://trackai.dev/attesta/security-period-report/v1"
  }
}
