{
  "question_id": "Q3",
  "registry_version": 1,
  "kind": "verifiable",
  "as_of": "2026-09-30T20:00:00.000Z",
  "scope": {
    "repository_id": "00000000-0000-4000-8000-0000000000a1",
    "from": "2026-07-01T00:00:00.000Z",
    "to": "2026-09-30T23:59:59.999Z"
  },
  "availability": "partial",
  "reasons": [
    {
      "code": "not_sealed_yet"
    }
  ],
  "figures": [
    {
      "key": "prs_merged",
      "availability": "recorded",
      "reasons": [],
      "value": {
        "type": "count",
        "count": 12
      },
      "evidence": {
        "count": 2,
        "statements_root": "sha256:aaaaaaaaaaaaaaaaaaaaaaaaaaaaaaaaaaaaaaaaaaaaaaaaaaaaaaaaaaaaaaaa",
        "records": [
          {
            "seq": 11,
            "digest": "sha256:bbbbbbbbbbbbbbbbbbbbbbbbbbbbbbbbbbbbbbbbbbbbbbbbbbbbbbbbbbbbbbbb"
          },
          {
            "seq": 12,
            "digest": "sha256:cccccccccccccccccccccccccccccccccccccccccccccccccccccccccccccccc"
          }
        ]
      }
    },
    {
      "key": "merged_ai_lines",
      "availability": "partial",
      "reasons": [
        {
          "code": "not_sealed_yet"
        }
      ],
      "value": {
        "type": "count",
        "count": 340
      },
      "evidence": {
        "count": 1,
        "statements_root": "sha256:dddddddddddddddddddddddddddddddddddddddddddddddddddddddddddddddd",
        "records": [
          {
            "seq": 11,
            "digest": "sha256:bbbbbbbbbbbbbbbbbbbbbbbbbbbbbbbbbbbbbbbbbbbbbbbbbbbbbbbbbbbbbbbb"
          }
        ]
      }
    }
  ],
  "wording": [
    "unknown_model_explicit"
  ],
  "drilldown": []
}
