{
  "question_id": "Q3",
  "registry_version": 1,
  "kind": "live",
  "as_of": "2026-10-15T09:30:00.000Z",
  "scope": {
    "repository_id": "00000000-0000-4000-8000-0000000000a1",
    "from": "2026-07-01T00:00:00.000Z",
    "to": "2026-09-30T23:59:59.999Z"
  },
  "availability": "recorded",
  "reasons": [],
  "figures": [
    {
      "key": "merged_ai_share",
      "availability": "recorded",
      "reasons": [],
      "value": {
        "type": "ratio",
        "numerator": 1420,
        "denominator": 3310
      },
      "breakdown": [
        {
          "dimension": "model",
          "key": "claude-code:claude-opus",
          "value": {
            "type": "ratio",
            "numerator": 1200,
            "denominator": 3310
          }
        },
        {
          "dimension": "model",
          "key": "unknown",
          "value": {
            "type": "ratio",
            "numerator": 220,
            "denominator": 3310
          }
        }
      ]
    }
  ],
  "wording": [
    "unknown_model_explicit"
  ],
  "drilldown": [
    {
      "scope": "repository",
      "id": "00000000-0000-4000-8000-0000000000a1",
      "label": "payments-service"
    },
    {
      "scope": "pull_request",
      "id": "00000000-0000-4000-8000-0000000000b1",
      "label": "#42"
    }
  ],
  "signed_evidence": {
    "path": "/api/attesta/statements",
    "query": {
      "repository_id": "00000000-0000-4000-8000-0000000000a1",
      "kind": "pr_merged",
      "from": "2026-07-01T00:00:00.000Z",
      "to": "2026-09-30T23:59:59.999Z"
    }
  }
}
